{
  "id": "geographic-partial-with-useful-results",
  "description": "PARTIAL coverage with useful results retains those results and creates a session incidence.",
  "provider": "facebook",
  "implementation_stage": "A",
  "runtime_check": "search_session_core",
  "given": {
    "intent": {
      "original_user_query": "baseball glove",
      "display_limit": 3,
      "selected_providers": ["facebook"],
      "generation": 7,
      "requested_geographic_scopes": [
        { "provider": "facebook", "scope": "Toda Venezuela" }
      ]
    },
    "policy": {
      "facebook": {
        "maximum_internal_acquisitions": 2,
        "maximum_acquisition_budget": 30,
        "candidate_buffer_multiplier": 4
      }
    },
    "scope": "Toda Venezuela",
    "steps": [
      { "key": "step-1", "candidate_limit": 5, "required_for_complete_coverage": true },
      { "key": "step-2", "candidate_limit": 5, "required_for_complete_coverage": true }
    ],
    "batches": {
      "step-1": { "candidates": [{ "title": "one", "identity": "1" }] },
      "step-2": { "error": "partition unavailable" }
    }
  },
  "expected": {
    "status": "SUCCESS",
    "coverage_status": "PARTIAL",
    "has_incidents": true,
    "completion_label": "Búsqueda completada con incidencias",
    "canonical_titles": ["one"]
  },
  "must_not": [
    "discard useful PARTIAL results",
    "relabel PARTIAL as COMPLETE",
    "implement concrete Facebook city aliases"
  ],
  "source_refs": [
    "openspec/changes/multi-market-search-semantics/specs/marketplace-query-routing/spec.md",
    "openspec/changes/multi-market-search-semantics/design.md",
    "docs/architecture/README.md",
    "docs/architecture/multi-market-search-core.puml",
    "docs/architecture/multi-market-search-sequence.puml"
  ]
}
